Company,Title,Link,Article
TCS,‘Made to work alone on rooftop’: TCS Nashik woman employee makes explosive ‘soft targets’ claim,https://www.moneycontrol.com/city/made-to-work-alone-on-rooftop-tcs-nashik-woman-employee-makes-explosive-soft-targets-claim-article-13890397.html,"TCS Nashik employee details harassment claims TCS Nashik staffer claims isolation, belongings seized Young female staff reportedly targeted and exploited at workplace Police probe ongoing; several staff, including HR, suspended Did our AI summary help? Fresh allegations have emerged from the ongoing controversy at the Nashik office of Tata Consultancy Services, with a woman employee claiming she was forced to work in isolation on a rooftop and had her personal belongings confiscated. Speaking to NDTV, the employee, who has been with the company for six years, said she was transferred to the Nashik office and then made to sit alone on a terrace, away from the main workplace. She alleged that her phone, bag, and other personal items were routinely taken away under the pretext of security. ""I was made to work alone on the rooftop, and my phone and bag were confiscated, Whenever I came downstairs to use the washroom or for other purposes, my mobile phone, bag, and all personal belongings were confiscated under the pretext of security or other excuses."" ""We have seen that many of the young employees who work in the company were being exploited. They were being brainwashed,"" she added, as quoted by NDTV. As per reports, the woman further alleged that young female employees were being specifically targeted and exploited at the workplace. According to her, women aged between 20 and 25 were seen as “soft targets” and subjected to manipulation and pressure. She also claimed that even the human resources department failed to address complaints effectively. Related Stories TCS ties up with Anthropic, to roll out Claude AI access to 50,000 employees No further downsizing planned; still need to attract the best talent: TCS Chairman N Chandrasekaran Far from being mortal threat, AI is the most significant opportunity yet for TCS: Chairman N Chandra... ""They thought that it would be easy to trap them. If you have any complaints, then you go to your HR. But here, even the HR was scared,"" she added. ""Thank God I survived otherwise, the same thing would have happened to me today,” she said as per NDTV. Her statements come amid a wider investigation into serious allegations at the Nashik unit, including sexual harassment, coercion, and misconduct. Police are currently probing multiple complaints filed by women employees, and several staff members, including an HR manager, have already been arrested and suspended. According to a report by NDTV, another employee reportedly alleged that workers were pressured into personal relationships and even influenced on religious lines, adding to the gravity of the case. Authorities have formed a Special Investigation Team (SIT) to examine the matter in detail. The revelations have sparked widespread concern about workplace safety and corporate accountability. The employee said she felt fortunate to have escaped serious harm and urged other women to speak up against what she described as a “dark culture” within the office. As investigations continue, the case has raised serious questions about employee protection mechanisms and oversight within large corporate setups. All arrested staff have been suspended by TCS."
TCS,"TCS Nashik sexual harassment case a failure of internal systems, processes: Industry experts",https://www.moneycontrol.com/news/business/information-technology/tcs-nashik-sexual-harassment-case-a-failure-of-internal-systems-processes-industry-experts-13888278.html,"Representative image TCS faces criticism for delay in handling harassment complaints Investigation led by TCS COO Aarthi Subramanian is ongoing Experts call it a failure in implementing the POSH policy Did our AI summary help? Tata Consultancy Services’ delay in responding to the sexual harassment and religious conversion complaints at its Nashik facility is a systemic failure in implementing the Prevention of Sexual Harassment (POSH) policy, say industry experts. Tata Sons Chairman N Chandrasekaran said on April 13 that a “thorough investigation is underway to establish the facts and identify all individuals responsible for this situation”. The company has appointed TCS chief operating officer (COO) Aarthi Subramanian to lead the investigation. Apart from the seven arrested accused, HR manager Nida Khan, who worked at the company’s Pune office and who allegedly ignored the victims' complaints, is absconding, reports have said. Reacting to the oversight at the senior level in the company, TV Mohandas Pai, former chief financial officer and HR head of Infosys and chairman of Aarin Capital Partners, said, “When a man grabs a woman in public and tries to assault her, people around should protest and support the woman. But clearly, everyone is living in an atmosphere of fear. There is a failure of systems and processes — absolutely.” Related Stories TCS ties up with Anthropic, to roll out Claude AI access to 50,000 employees TCS will take strict action if any associate is found responsible: N Chandrasekaran on Nashik case TCS AI revenue nears $2.5 billion annualised; AI agents could match employee count: N Chandrasekaran “There appears to be pandering to religious fanatics. There is open, aggressive behaviour from such groups. This has happened in other companies too — I’ve personally seen instances where people gang up together.” According to Pai, better communication channels are needed for employees to directly connect with managers two-levels above them. Employees should have regular “skip meetings” with a manager two levels above, without their immediate manager present. “This doesn’t seem to be happening, because the issue has persisted for a long time,” Pai said. FIRs and arrests so far The arrested individuals have been identified as Asif Ansari, Shafi Sheikh, Shah Rukh Qureshi, Raza Memon, Tausif Attar, Danish Sheikh and Ashwini Chainani. The case first came into light when in March, when  a woman working at TCS filed a complaint alleging that a colleague had maintained a physical relationship with her by promising marriage. During the investigation, police registered eight more FIRs (first information reports) related to sexual harassment and religious conversion cases, as per a media report. The action was taken based on intelligence inputs received by the Nashik Police Commissioner’s office. Nashik police had deployed some of its constables to go undercover to gather information, and work as TCS employees between February and March. The case is currently under investigation by a special investigation team (SIT) led by assistant commissioner of police (Crime) Sandeep Mitke. Failure of implementing POSH Act With more than 584,519 staff globally, TCS is one of the largest private sector employers in India, with well-structured employee policies in place being a Tata Group company. “TCS has well established processes for raising complaints. Probably the employees did not follow them either due to ignorance or due to possible ramifications that they thought that they would undergo if they are complaining,” said Aditya Mishra, MD & CEO, CIEL HR, a recruitment and staffing firm. “In this particular case, it was all people with position of power and authority.” Several accused who have been arrested are in team-leader positions. Mishra said companies have whistleblower policies and there are three levels of escalations involved. Members from both genders need to be a part of the Internal Complaint Committee (ICC) and sexual harassment committees. Employees are supposed to be trained annually for them to understand what would amount to sexual harassment. Pai called the case a complete “failure” in implementing the POSH policy. Any complaint must go to a high-level, independent channel such as a dedicated webpage not to a direct manager, he said. “Managers are often at a lower level and complaints must instead go to a body supervised by the audit committee, not management,” he said. In the TCS case, Nashik police sent six of its women officers undercover to work at the facility between March and April to gather information. Is it a Tier-II, III city problem? “There seems to be a pattern emerging at TCS in HR practices, first with the bribe-for-jobs case, then the layoffs and now this Nashik case. TCS took action and accountability only after media attention and social media pressure,” said Pareekh Jain, CEO, EIIRTrend. “This is like some bureaucracy and the complaints may have not reached the HR head. People at CXO levels should have been aware of this and the head of HR must be questioned.” He wondered if this would have happened at one of TCS’ Bengaluru, Mumbai or Chennai offices. “TCS is spreading to tier-II and tier-III cities towns, but employee wellbeing policies were clearly ineffective in this case. Policies need to be implemented in letter and spirit,” he said. What did the company say? Chandrasekaran called the allegations emerging from the Nashik unit “gravely concerning and anguishing” . “This incident is being treated with the utmost seriousness. Action has already been initiated against the accused employees, and the company is extending its full cooperation to the ongoing investigations. The Tata Group maintains a zero-tolerance policy towards any form of coercion or misconduct by its employees,” he said."
TCS,"A first for TCS: Revenue growth falls despite strong deals, margins",https://www.moneycontrol.com/news/business/information-technology/a-first-for-tcs-revenue-growth-falls-despite-strong-deals-margins-13885457.html,"In FY26, TCS reported revenue of Rs 2.67 lakh crore, up 4.6 percent year-on-year IT behemoth Tata Consultancy Services (TCS) has reported a 0.5 percent year-on-year decline in USD terms in FY26 revenue growth, the first time since it went public in 2004. This is coming in a year when the IT services giant also reported a strong order book and good operating margin despite the challenging macroeconomic scenario. The divergence suggests a structural mismatch i.e., strong deal momentum but weakening revenue conversion. Moreover, India's services leader’s 2.4 percent annual revenue decline in constant currency terms also has analysts worried. The slowdown has become more visible after the BSNL deal tapered off, with macro pressures and rising competition for large deals weighing on growth. Related Stories The Reading List: June 12, 2026 Business in the Week Ahead (June 15-19, 2026) UPI’s transaction volume and user adoption growth metrics see sharp slowdown “With the BSNL deal tapering off, TCS’s underlying slowdown has become more visible, even as competition for large deals has intensified and pricing has become more aggressive,” Pareekh Jain, CEO of Pareekh Consulting and EIIRTrend said. Rightly so, revenue from India de-grew by 28.6 percent YoY in CC, which was earlier a strong support when North America and Europe slowed down amid US trade tariff tensions and macro concerns. “The bigger issue is not just the quarter in isolation, but what it says about the broader demand environment for large IT services firms. While reported growth was supported by currency tailwinds, the underlying trend still reflects a sluggish spending cycle, especially in discretionary technology programs,” said Harshal Dasani, Business Head at INVasset PMS. What gives? Industry analysts believe it’s a structural shift in how revenue is getting generated from the same large deals, as customers demand faster outcomes with lower human efforts in a post AI world. The Mumbai-headquartered IT firm had also revamped its business strategy and operations to align with its AI ambitions in FY26, ending the year with $2.3 billion in annualised AI revenue, accounting for nearly 7.5 percent of the company’s overall revenue. According to Phil Fersht, founder and CEO of HFS Research, TCS’ annual revenue decline in CC terms, is the clearest evidence yet that the industry's “core commercial logic is being rewritten.” While it’s clear that the IT services demand is far from disappearing as deal pipelines remain resilient with large deals continuing to come in and margins holding above 25 percent, the way the demand is being consumed is fast changing, noted Fersht. In his blog post, Fersht said, “Clients are no longer buying effort. They are demanding outcomes. AI is compressing delivery timelines, reducing headcount intensity, and forcing providers to deliver more value for less revenue. That creates a brutal tension: strong bookings on one side, muted revenue realization on the other.” What did the management say? TCS reported $12 billion in Q4 order book, that includes three mega deals mostly renewals from major customers such as Marks & Spencer. For the full-year, the deal total contract value (TCV) stood at $40.7 billion with five multi-year mega deals in total. Meanwhile, for the full year FY26, TCS reported revenue of Rs 2.67 lakh crore, up 4.6 percent year-on-year, while operating margin improved to 25 percent and net margin to 19.8 percent -- both the highest levels in the last four years. This gives TCS enough fuel to hope for a consistent FY27 amid the geopolitical uncertainties. “Even in a year marked by global uncertainty, we have demonstrated resilience, discipline and the ability to lead through complexity. Our performance FY26 is not just sound execution, but enduring trust from clients who are committing to longer-term partnerships,” said TCS CEO and MD K Krithivasan. He added, “Our client relationships are expanding across revenue bands. Accelerating AI momentum and foundational investments like HyperVault, are building the next phase of TCS with conviction. As enterprises increasingly seek partners who can deliver certainty, accountability and outcomes end to end, TCS stands exceptionally well positioned.” After a year full of reworking business models, venturing in building data centers, trimming workforce globally, Krithivasan said that the company is entering the new financial year with “confidence, clarity of purpose, and an unwavering focus on delivering growth with resilience and trust.” How are brokerages reacting? Even as TCS reported a rare YoY contraction in constant currency terms, brokerages have largely refrained from calling it a structural inflection, instead attributing the slowdown to near-term factors and betting on a recovery led by deal wins and AI-led demand. Brokerage Elara, for instance, pinned the weakness on the tapering of the BSNL deal and maintained that underlying international growth remains intact, while HDFC Securities acknowledged the constant currency decline but framed it as transitory, pointing to improving deal wins, vertical recovery, and stronger visibility into FY27. Brokerage Nomura, however, strikes a slightly more nuanced note, flagging that while growth was broadly in line, underlying trends remain uneven with continued macro uncertainty weighing on client spending. However, it stops short of calling it a structural break. Instead, it highlights strong deal wins and a pick up in AI-led projects. The brokerage expects FY27 to be better on the back of strong pipeline and improved execution."
TCS,Buy Tata Consultancy Services; target of Rs 3450: Prabhudas Lilladher,https://www.moneycontrol.com/news/business/stocks/buy-tata-consultancy-services-target-of-rs-3450-prabhudas-lilladher-13885283.html,"buy TCS TCS Watchlist Portfolio Message Follow NSE/BSE Select NSE LIVE BSE LIVE Trade Day High Day Low Volume (NSE) More × Add to Watchlist × Prabhudas Lilladher's research report on Tata Consultancy Services TCS Q4’s performance of 1.2% QoQ CC growth was largely in line with our estimates of 1.3% growth, aided by broad-based growth across all major geographies and segments except BFSI & CMT. AI revenue momentum continued with annualized revenue of USD 2.3 bn, up 27.8% QoQ and now forms 7.7% of revenue mix. However, geopolitical conflicts are not only having a direct impact on Travel and Transportation verticals, but delaying decisions within key verticals, especially BFSI. The vertical (BFSI) reported 2.9% USD growth in FY26, which will likely create a headwind in FY27E. The deal TCV growth remains weak (3.6% YoY) at 40.7b, despite the company winning 5 mega deals in FY26. Considering the factors above, we are trimming our revenue estimates by 40/30bps; expect CC revenue growth of 4.5% including inorganic (30bps) in FY27E followed by 5.1% in FY28E, respectively. On the margin front, we expect improvement of 30bps & 20bps (earlier 50bps & 30bps), respectively in FY27E & FY28E on account of forging partnerships with frontier model providers and investments in talent re-skilling activities. Outlook However, the management indicated that achieving 26% EBIT margin continues to be the long-term aspiration. We assign 20x to FY28E EPS that translates a TP of 3,450. Maintain BUY. For all recommendations report, click here Related Stories Buy Delhivery; target of Rs 517: Geojit Financial Services Buy Equitas Small Finance Bank; target of Rs 90: ICICI Securities Buy Mahanagar Gas; target of Rs 1390: Motilal Oswal Disclaimer: The views and investment tips expressed by investment experts/broking houses/rating agencies on moneycontrol.com are their own, and not that of the website or its management. Moneycontrol.com advises users to check with certified experts before taking any investment decisions. TCS - 1004026 - prabhu"
TCS,"TCS Consolidated March 2026 Net Sales at Rs 70,698.00 crore, up 9.65% Y-o-Y",https://www.moneycontrol.com/news/business/earnings/tcs-consolidated-march-2026-net-sales-at-rs-70698-00-crore-up-9-65-y-o-y-13885270.html,"TCS TCS Watchlist Portfolio Message Follow NSE/BSE Select NSE LIVE BSE LIVE Trade Day High Day Low Volume (NSE) More × Add to Watchlist × Reported Consolidated quarterly numbers for Tata Consultancy Services are: Net Sales at Rs 70,698.00 crore in March 2026 up 9.65% from Rs. 64,479.00 crore in March 2025. Quarterly Net Profit at Rs. 13,718.00 crore in March 2026 up 12.22% from Rs. 12,224.00 crore in March 2025. EBITDA stands at Rs. 20,033.00 crore in March 2026 up 11.25% from Rs. 18,008.00 crore in March 2025. TCS EPS has increased to Rs. 37.92 in March 2026 from Rs. 33.79 in March 2025. TCS shares closed at 2,589.00 on April 08, 2026 (NSE) and has given -15.44% returns over the last 6 months and -20.26% over the last 12 months. Tata Consultancy Services Consolidated Quarterly Results in Rs. Cr. Mar'26 Dec'25 Mar'25 Net Sales/Income from operations 70,698.00 67,087.00 64,479.00 Other Operating Income -- -- -- Total Income From Operations 70,698.00 67,087.00 64,479.00 EXPENDITURE Consumption of Raw Materials -- -- -- Purchase of Traded Goods -- -- -- Increase/Decrease in Stocks -- -- -- Power & Fuel -- -- -- Employees Cost 40,143.00 38,530.00 36,762.00 Depreciation 1,406.00 1,380.00 1,379.00 Excise Duty -- -- -- Admin. And Selling Expenses -- -- -- R & D Expenses -- -- -- Provisions And Contingencies -- -- -- Exp. Capitalised -- -- -- Other Expenses 11,279.00 10,288.00 10,737.00 P/L Before Other Inc., Int., Excpt. Items & Tax 17,870.00 16,889.00 15,601.00 Other Income 757.00 1,118.00 1,028.00 P/L Before Int., Excpt. Items & Tax 18,627.00 18,007.00 16,629.00 Interest 265.00 538.00 227.00 P/L Before Exceptional Items & Tax 18,362.00 17,469.00 16,402.00 Exceptional Items -- -3,391.00 -- P/L Before Tax 18,362.00 14,078.00 16,402.00 Tax 4,578.00 3,358.00 4,109.00 P/L After Tax from Ordinary Activities 13,784.00 10,720.00 12,293.00 Prior Year Adjustments -- -- -- Extra Ordinary Items -- -- -- Net Profit/(Loss) For the Period 13,784.00 10,720.00 12,293.00 Minority Interest -66.00 -63.00 -69.00 Share Of P/L Of Associates -- -- -- Net P/L After M.I & Associates 13,718.00 10,657.00 12,224.00 Equity Share Capital 362.00 362.00 362.00 Reserves Excluding Revaluation Reserves -- -- -- Equity Dividend Rate (%) -- -- -- EPS Before Extra Ordinary Basic EPS 37.92 29.45 33.79 Diluted EPS 37.92 29.45 33.79 EPS After Extra Ordinary Basic EPS 37.92 29.45 33.79 Diluted EPS 37.92 29.45 33.79 Public Share Holding No Of Shares (Crores) -- -- -- Share Holding (%) -- -- -- Promoters and Promoter Group Shareholding a) Pledged/Encumbered - Number of shares (Crores) -- -- -- - Per. of shares (as a % of the total sh. of prom. and promoter group) -- -- -- - Per. of shares (as a % of the total Share Cap. of the company) -- -- -- b) Non-encumbered - Number of shares (Crores) -- -- -- - Per. of shares (as a % of the total sh. of prom. and promoter group) -- -- -- - Per. of shares (as a % of the total Share Cap. of the company) -- -- -- Source : Dion Global Solutions Limited"
TCS,"TCS Standalone March 2026 Net Sales at Rs 58,052.00 crore, up 7.23% Y-o-Y",https://www.moneycontrol.com/news/business/earnings/tcs-standalone-march-2026-net-sales-at-rs-58052-00-crore-up-7-23-y-o-y-13885266.html,"TCS TCS Watchlist Portfolio Message Follow NSE/BSE Select NSE LIVE BSE LIVE Trade Day High Day Low Volume (NSE) More × Add to Watchlist × Reported Standalone quarterly numbers for Tata Consultancy Services are: Net Sales at Rs 58,052.00 crore in March 2026 up 7.23% from Rs. 54,136.00 crore in March 2025. Quarterly Net Profit at Rs. 14,526.00 crore in March 2026 up 30.68% from Rs. 11,116.00 crore in March 2025. EBITDA stands at Rs. 19,646.00 crore in March 2026 up 22.86% from Rs. 15,991.00 crore in March 2025. TCS EPS has increased to Rs. 40.15 in March 2026 from Rs. 30.72 in March 2025. TCS shares closed at 2,589.00 on April 08, 2026 (NSE) and has given -15.44% returns over the last 6 months and -20.26% over the last 12 months. Tata Consultancy Services Standalone Quarterly Results in Rs. Cr. Mar'26 Dec'25 Mar'25 Net Sales/Income from operations 58,052.00 55,567.00 54,136.00 Other Operating Income -- -- -- Total Income From Operations 58,052.00 55,567.00 54,136.00 EXPENDITURE Consumption of Raw Materials -- -- -- Purchase of Traded Goods -- -- -- Increase/Decrease in Stocks -- -- -- Power & Fuel -- -- -- Employees Cost 28,630.00 27,842.00 27,215.00 Depreciation 944.00 1,102.00 1,118.00 Excise Duty -- -- -- Admin. And Selling Expenses -- -- -- R & D Expenses -- -- -- Provisions And Contingencies -- -- -- Exp. Capitalised -- -- -- Other Expenses 13,292.00 12,031.00 12,852.00 P/L Before Other Inc. , Int., Excpt. Items & Tax 15,186.00 14,592.00 12,951.00 Other Income 3,516.00 2,049.00 1,922.00 P/L Before Int., Excpt. Items & Tax 18,702.00 16,641.00 14,873.00 Interest 238.00 512.00 201.00 P/L Before Exceptional Items & Tax 18,464.00 16,129.00 14,672.00 Exceptional Items -- -3,217.00 -- P/L Before Tax 18,464.00 12,912.00 14,672.00 Tax 3,938.00 2,722.00 3,556.00 P/L After Tax from Ordinary Activities 14,526.00 10,190.00 11,116.00 Prior Year Adjustments -- -- -- Extra Ordinary Items -- -- -- Net Profit/(Loss) For the Period 14,526.00 10,190.00 11,116.00 Equity Share Capital 362.00 362.00 362.00 Reserves Excluding Revaluation Reserves -- -- -- Equity Dividend Rate (%) -- -- -- EPS Before Extra Ordinary Basic EPS 40.15 28.16 30.72 Diluted EPS 40.15 28.16 30.72 EPS After Extra Ordinary Basic EPS 40.15 28.16 30.72 Diluted EPS 40.15 28.16 30.72 Public Share Holding No Of Shares (Crores) -- -- -- Share Holding (%) -- -- -- Promoters and Promoter Group Shareholding a) Pledged/Encumbered - Number of shares (Crores) -- -- -- - Per. of shares (as a % of the total sh. of prom. and promoter group) -- -- -- - Per. of shares (as a % of the total Share Cap. of the company) -- -- -- b) Non-encumbered - Number of shares (Crores) -- -- -- - Per. of shares (as a % of the total sh. of prom. and promoter group) -- -- -- - Per. of shares (as a % of the total Share Cap. of the company) -- -- -- Source : Dion Global Solutions Limited"
