Company,Title,Link,Article
HCL Technologies,"Stocks to Watch Today: JSW Energy, HCL Tech, RBL Bank, Amagi Media Labs, Vikram Solar, CreditAccess, Rallis India, Supreme Petrochem in focus on 21 January",https://www.moneycontrol.com/news/business/markets/stocks-to-watch-today-jsw-energy-hcl-tech-rbl-bank-amagi-media-labs-vikram-solar-creditaccess-rallis-india-supreme-petrochem-in-focus-on-21-january-13782309.html,"Stocks to Watch Today, 21 January Stocks in focus on January 21: JSW Energy, HCL Tech, RBL Bank, Amagi Media Labs, Vikram Solar, CreditAccess, Rallis India, Supreme Petrochem Did our AI summary help? MC08 EDL SP MC08 Watchlist Portfolio Message Follow NSE/BSE Select NSE LIVE BSE LIVE Trade Day High Day Low Volume (NSE) More EDL Watchlist Portfolio Message Follow NSE/BSE Select NSE LIVE BSE LIVE Trade Day High Day Low Volume (NSE) More SP Watchlist Portfolio Message Follow NSE/BSE Select NSE LIVE BSE LIVE Trade Day High Day Low Volume (NSE) More × Add to Watchlist × Let's catch up on the latest news from the stock market. From significant investments to major deals, quarterly earnings, order wins, and appointments, here’s a quick look at which stocks will be in focus in today's trade: Results Today Dr Reddys Laboratories, Eternal, Bank of India, Canara HSBC Life Insurance Company, Bajaj Consumer Care, Dalmia Bharat, Epack Prefab Technologies, Hindustan Petroleum Corporation, Jindal Stainless, KEI Industries, PNB Housing Finance, Supreme Industries, Tata Communications, UTI Asset Management Company, and Waaree Energies will release their December quarter earnings today. Quarterly Earnings United Spirits Q3 (Consolidated YoY) Related Stories IFCI shares hit 20% upper circuit as NSE likely to file DRHP next week Bank Nifty jumps 3%, all 14 stocks gain sharply; HDFC Bank, Axis Bank among top drivers of banking r... Nestle India declines 3% after FSSAI issues notice over alleged insect detection in Maggi; FMCG firm... Profit jumps 24.8% to Rs 418 crore Vs Rs 335 crore Revenue rises 7.6% to Rs 3,694 crore Vs Rs 3,433 crore Board approves further investment in Sober by subscribing to 1,762 CCPS for Rs 3.2 crore. With this, company’s stake in Sober to rise from 15% to 25% EPACK Durable Q3 (Consolidated YoY) Profit increases 3.2% to Rs 2.6 crore Vs Rs 2.5 crore Revenue soars 13.5% to Rs 427.8 crore Vs Rs 376.8 crore Supreme Petrochem Q3 (Standalone YoY) Profit plunges 57.7% to Rs 30.1 crore Vs Rs 71.4 crore Revenue declines 10% to Rs 1,264.7 crore Vs Rs 1,405.3 crore Persistent Systems Q3 (Consolidated YoY) Profit jumps 17.8% to Rs 439.4 crore Vs Rs 372.9 crore Revenue soars 23.4% to Rs 3,778.2 crore Vs Rs 3,062.2 crore EBIT surges 19.1% to Rs 542.7 crore Vs Rs 455.7 crore EBIT margin drops to 14.4% Vs 14.9% Dollar revenue spikes 17.3% to $422.5 million Vs $360.2 million IndiaMART InterMESH Q3 (Consolidated YoY) Profit zooms 55.6% to Rs 188.3 crore Vs Rs 121 crore Revenue increases 13.4% to Rs 401.6 crore Vs Rs 354.3 crore Other income jumps to Rs 135.4 crore Vs Rs 44.9 crore Rallis India Q3 (Consolidated YoY) Profit sinks 81.8% to Rs 2 crore Vs Rs 11 crore Revenue grows 19.3% to Rs 623 crore Vs Rs 522 crore Exceptional loss stands at Rs 35 crore Vs Nil CreditAccess Grameen Q3 (Consolidated YoY) Profit stands at Rs 252.1 crore Vs loss of Rs 99.5 crore Net interest income rises 13% to Rs 975.6 crore Vs Rs 862.8 crore Shoppers Stop Q3 (Consolidated YoY) Profit sinks 69.1% to Rs 16.12 crore Vs Rs 52.2 crore Revenue rises 2.6% to Rs 1,415.8 crore Vs Rs 1,379.5 crore Exceptional loss stands at Rs 17.7 crore Vs Nil DCM Shriram Q3 (Consolidated YoY) Profit drops 19% to Rs 212.1 crore Vs Rs 262.1 crore Revenue soars 13.8% to Rs 4,003.3 crore Vs Rs 3,518.9 crore AU Small Finance Bank Q3 (YoY) Profit surges 26.3% to Rs 667.6 crore Vs Rs 528.4 crore Net interest income grows 15.7% to Rs 2,341.3 crore Vs Rs 2,022.7 crore Gross NPA falls to 2.30% Vs 2.41% (QoQ) Net NPA flat at 0.88% (QoQ) Vikram Solar Q3 (Consolidated YoY) Profit spikes over 5-fold to Rs 98.1 crore Vs Rs 19.02 crore Revenue rises 7.8% to Rs 1,105.9 crore Vs Rs 1,026 crore Labour code impact stands at Rs 56 crore Vs Nil Cyient DLM Q3 (Consolidated YoY) Profit increases 2.2% to Rs 11.2 crore Vs Rs 10.99 crore Revenue plunges 31.7% to Rs 303.3 crore Vs Rs 444.2 crore Stocks to Watch JSW Energy The company’s subsidiary, JSW Thermal Energy Two Limited, has signed a Power Purchase Agreement (PPA) with West Bengal State Electricity Distribution Company for a greenfield 1,600 MW (2 × 800 MW) super/ultra-supercritical thermal power plant. The project will be commissioned in Salboni, West Bengal, within six years. HDFC Bank The Reserve Bank of India (RBI) has approved the reappointment of Kaizad Bharucha as the Whole-time Director (Deputy Managing Director) of HDFC Bank for a further period of three years, effective April 19, 2026. HCL Technologies The global technology company has announced a partnership with Carahsoft Technology Corp, a trusted government IT solutions provider, to accelerate digital transformation in the US public sector. Power Grid Corporation of India The Board has approved proposals worth Rs 914 crore for the procurement of cold spare transformers and reactors. Highway Infrastructure The company has received a Letter of Award (LoA) from the National Highways Authority of India (NHAI) for engagement as the user-fee agency at the Mundka Fee Plaza, located on the strategically significant Urban Extension Road-11 (UER-11) corridor connecting Delhi and Haryana. The project, valued at Rs 64.68 crore, involves the operation and collection of user fees at the Mundka Toll Plaza, along with the upkeep and maintenance of associated facilities, including toilet blocks and consumables. RBL Bank The Competition Commission of India (CCI) has approved the proposed acquisition of a certain shareholding in RBL Bank by Emirates NBD Bank (P.J.S.C.). Tata Steel The Competition Commission of India (CCI) has approved the acquisition of 50.01 percent equity share capital of Thriveni Pellets by Tata Steel. Embassy Developments The company announced its expansion into the Mumbai Metropolitan Region (MMR), with plans to invest Rs 4,500 crore to expand its Mumbai footprint through three marquee residential projects in Worli, Juhu, and Alibaug. Collectively, the projects represent a combined Gross Development Value (GDV) of over Rs 12,000 crore and a total development footprint of approximately 1.58 million square feet (RERA carpet area). Project launches are scheduled to commence from Q4 FY2026. Bulk Deals Aditya Birla Lifestyle Brands , Aditya Birla Fashion and Retail Fidelity Securities Fund – Fidelity Blue Chip Growth Fund sold 2.36 crore equity shares (equivalent to 1.94 percent of the paid-up equity) in Aditya Birla Lifestyle Brands for Rs 260.67 crore, at a price of Rs 110 per share. Additionally, the same fund offloaded 2.15 crore equity shares (1.76 percent stake) in Aditya Birla Fashion and Retail for Rs 142.63 crore, at a price of Rs 66.2 per share. However, Societe Generale – ODI acquired 74.97 lakh shares (0.61 percent stake) in Aditya Birla Fashion and Retail at Rs 65.78 per share, amounting to Rs 49.31 crore. P E Analytics Hornbill Orchid India Fund exited PropEquity by selling its entire holding of 4.04 lakh shares (3.86 percent stake) at Rs 165.01 per share, aggregating to Rs 6.67 crore. Meanwhile, Samir Jasuja and his mother-in-law, Manorama Pawah, acquired a combined 4.24 percent stake in the company. Samir Jasuja purchased 3.36 lakh shares for Rs 5.54 crore, while Manorama Pawah acquired 1.09 lakh shares for Rs 1.8 crore, both at a price of Rs 165 per share. Mainboard Listing Amagi Media Labs SME Listing GRE Renew Enertech Indo SMC Narmadesh Brass Industries Stocks Trade Ex-Dividend ICICI Prudential Asset Management Company Angel One Stock Trades Ex-Date for Income Distribution (InvIT) Property Share Investment Trust - Propshare Platina Stock Trades Ex-Date for Income Distribution RITES Propshare Titania SM REIT - IPO (Second scheme of the Property Share Investment Trust) Stock Trades Ex-Date for Resolution Plan -Suspension Cian Healthcare Stocks in F&O ban Sammaan Capital SAIL"
HCL Technologies,"HCL Tech Consolidated December 2025 Net Sales at Rs 33,872.00 crore, up 13.32% Y-o-Y",https://www.moneycontrol.com/news/business/earnings/hcl-tech-consolidated-december-2025-net-sales-at-rs-33872-00-crore-up-13-32-y-o-y-13780924.html,"HCL02 HCL02 Watchlist Portfolio Message Follow NSE/BSE Select NSE LIVE BSE LIVE Trade Day High Day Low Volume (NSE) More × Add to Watchlist × Reported Consolidated quarterly numbers for HCL Technologies are: Net Sales at Rs 33,872.00 crore in December 2025 up 13.32% from Rs. 29,890.00 crore in December 2024. Quarterly Net Profit at Rs. 4,076.00 crore in December 2025 down 11.22% from Rs. 4,591.00 crore in December 2024. EBITDA stands at Rs. 7,797.00 crore in December 2025 up 6.27% from Rs. 7,337.00 crore in December 2024. HCL Tech EPS has decreased to Rs. 15.06 in December 2025 from Rs. 16.94 in December 2024. HCL Tech shares closed at 1,716.80 on January 16, 2026 (NSE) and has given 12.18% returns over the last 6 months and -4.42% over the last 12 months. HCL Technologies Consolidated Quarterly Results in Rs. Cr. Dec'25 Sep'25 Dec'24 Net Sales/Income from operations 33,872.00 31,942.00 29,890.00 Other Operating Income -- -- -- Total Income From Operations 33,872.00 31,942.00 29,890.00 EXPENDITURE Consumption of Raw Materials -- -- -- Purchase of Traded Goods 841.00 628.00 578.00 Increase/Decrease in Stocks -69.00 -8.00 66.00 Power & Fuel -- -- -- Employees Cost 18,867.00 18,301.00 16,576.00 Depreciation 1,127.00 1,043.00 1,039.00 Excise Duty -- -- -- Admin. And Selling Expenses -- -- -- R & D Expenses -- -- -- Provisions And Contingencies -- -- -- Exp. Capitalised -- -- -- Other Expenses 6,821.00 6,476.00 5,810.00 P/L Before Other Inc., Int., Excpt. Items & Tax 6,285.00 5,502.00 5,821.00 Other Income 385.00 415.00 477.00 P/L Before Int., Excpt. Items & Tax 6,670.00 5,917.00 6,298.00 Interest 205.00 215.00 166.00 P/L Before Exceptional Items & Tax 6,465.00 5,702.00 6,132.00 Exceptional Items -956.00 -- -- P/L Before Tax 5,509.00 5,702.00 6,132.00 Tax 1,427.00 1,466.00 1,538.00 P/L After Tax from Ordinary Activities 4,082.00 4,236.00 4,594.00 Prior Year Adjustments -- -- -- Extra Ordinary Items -- -- -- Net Profit/(Loss) For the Period 4,082.00 4,236.00 4,594.00 Minority Interest -6.00 -1.00 -3.00 Share Of P/L Of Associates -- -- -- Net P/L After M.I & Associates 4,076.00 4,235.00 4,591.00 Equity Share Capital 543.00 543.00 543.00 Reserves Excluding Revaluation Reserves -- -- -- Equity Dividend Rate (%) -- -- -- EPS Before Extra Ordinary Basic EPS 15.06 15.63 16.94 Diluted EPS 15.05 15.61 16.93 EPS After Extra Ordinary Basic EPS 15.06 15.63 16.94 Diluted EPS 15.05 15.61 16.93 Public Share Holding No Of Shares (Crores) -- -- -- Share Holding (%) -- -- -- Promoters and Promoter Group Shareholding a) Pledged/Encumbered - Number of shares (Crores) -- -- -- - Per. of shares (as a % of the total sh. of prom. and promoter group) -- -- -- - Per. of shares (as a % of the total Share Cap. of the company) -- -- -- b) Non-encumbered - Number of shares (Crores) -- -- -- - Per. of shares (as a % of the total sh. of prom. and promoter group) -- -- -- - Per. of shares (as a % of the total Share Cap. of the company) -- -- -- Source : Dion Global Solutions Limited"
HCL Technologies,"Trade Spotlight: How should you trade Tata Elxsi, Colgate Palmolive, Shriram Finance, Canara Bank, CCL Products, and others on January 20?",https://www.moneycontrol.com/news/business/markets/trade-spotlight-how-should-you-trade-tata-elxsi-colgate-palmolive-shriram-finance-canara-bank-ccl-products-and-others-on-january-20-13779904.html,"Top Trading Ideas for January 20 Experts pick top 10 trading ideas for January 20 including Tata Elxsi, Colgate Palmolive, Shriram Finance, Canara Bank, CCL Products Did our AI summary help? BA06 BI03 TEI BA06 Watchlist Portfolio Message Follow NSE/BSE Select NSE LIVE BSE LIVE Trade Day High Day Low Volume (NSE) More BI03 Watchlist Portfolio Message Follow NSE/BSE Select NSE LIVE BSE LIVE Trade Day High Day Low Volume (NSE) More TEI Watchlist Portfolio Message Follow NSE/BSE Select NSE LIVE BSE LIVE Trade Day High Day Low Volume (NSE) More × Add to Watchlist × Equity benchmarks declined four-tenths of a percent on January 19, with market breadth consistently favouring bears. About 2,190 shares were under pressure against 728 shares that advanced on the NSE. The market is expected to consolidate and trade within the previous week’s range. Below are some short-term trading ideas to consider: Jigar S Patel, Senior Manager - Equity Research at Anand Rathi Bajaj Auto | CMP: Rs 9,429.5 Bajaj Auto has entered a healthy pullback phase after breaking out above its long-term falling trendline, as visible on the chart. Such pullbacks are often considered constructive, as they allow prices to consolidate and attract fresh buying interest without damaging the overall trend structure. Related Stories Passive investing to gain share in India as institutional participation rises: Raamdeo Agrawal Will Nifty hit 24,000 next week after 2% rally today; analysts recommend trading levels Nippon India MF buys additional over 1 percent stake in Sanofi India From an indicator perspective, the Directional Movement Index (DMI) shows the positive line clearly in control, suggesting that buying strength remains dominant. The Average Directional Index (ADX) is holding above the 20 level, indicating that the trend is gaining stability and strength rather than weakening. Meanwhile, the MACD remains above the zero line, reflecting positive momentum and supporting the continuation of the bullish trend. Based on this technical combination, the pullback is viewed as an opportunity rather than a sign of weakness. Traders may consider entering long positions in the Rs 9,450–9,400 zone. Strategy: Buy Target: Rs 10,200 Stop-Loss: Rs 9,000 Balkrishna Industries | CMP: Rs 2,431.6 Balkrishna Industries has shown a strong improvement in its technical structure, supported by multiple bullish signals. The 9- and 26-DEMA have delivered a bullish crossover, indicating a shift in short-term momentum in favour of the bulls. In addition, the stock has confirmed a breakout above its falling trendline, suggesting a change in the medium-term trend. Momentum indicators further strengthen the positive outlook. The DMI has recorded a bullish crossover, reflecting increasing buying pressure, while the MACD has moved above the zero line, highlighting a transition into positive momentum territory. Traders may consider entering long positions in the Rs 2,410–2,400 zone. Strategy: Buy Target: Rs 2,600 Stop-Loss: Rs 2,300 Tata Elxsi | CMP: Rs 5,563 Tata Elxsi has successfully retested its breakout zone, as highlighted on the chart, confirming the strength and sustainability of the recent breakout. Notably, volumes are picking up near lower levels, indicating strong accumulation interest and reinforcing the positive price structure. The breakout above the falling trendline further supports a shift in the medium-term trend from bearish to bullish. On the momentum front, the MACD is positioned above the zero line, signalling positive momentum, while the DMI continues to reflect bullish dominance. Additionally, the ADX is holding above the 25 level, suggesting that the emerging trend is gaining strength and reliability. Traders may consider entering long positions in the Rs 5,600–5,500 zone. Strategy: Buy Target: Rs 6,250 Stop-Loss: Rs 5,200 Jay Thakkar, Vice President & Head of Derivatives and Quant Research at ICICI Securities Colgate Palmolive India | CMP: Rs 2,178 Colgate Palmolive has provided a breakout from the falling trendline, accompanied by a decrease in open interest, indicating short covering. There had been heavy short positions in the stock, and it had declined nearly 50 percent from its all-time high. Significant positive divergence is visible on both daily and weekly charts, indicating a higher probability of continued short covering. The risk-to-reward ratio is clearly in favour of the bulls; hence, one may initiate long positions in this series. Options data indicates that the Rs 2,200 strike has the highest Call base, and a close above this level could lead to further upward momentum. Buy Colgate Palmolive futures in the range of Rs 2,170–2,190. Strategy: Buy Target: Rs 2,250, Rs 2,300 Stop-Loss: Rs 2,120 Mankind Pharma | CMP: Rs 2,117.2 Mankind Pharma has been forming lower tops and lower bottoms, with an increase in open interest clearly indicating short build-up in the near term. Hence, the short-term trend remains negative. A bounce witnessed a few weeks ago was largely due to short covering, and once that move ended, the stock resumed its primary downtrend, with fresh additions on the short side. There is a huge Call base at the Rs 2,200 strike, and the stock has closed significantly below this level. The maximum pain is also at the Rs 2,200 level. Until this level is decisively crossed, the short-term trend is likely to remain weak. Any bounce should be utilised as a selling opportunity. Sell Mankind Pharma futures in the range of Rs 2,120–2,140. Strategy: Sell Target: Rs 2,060, Rs 2,020 Stop-Loss: Rs 2,180 HCL Technologies | CMP: Rs 1,716.8 HCL Tech has been moving higher following its Q3 results, indicating a bullish short-term trend. There has been a decrease in open interest along with a rise in price, suggesting short covering. Large-cap IT stocks have largely witnessed short build-up, with heavyweights such as Wipro, TCS, and Infosys still carrying substantial short positions. Meanwhile, midcap IT stocks have been outperforming large caps. Despite this, HCL Tech has emerged as an outperformer within the large-cap IT space and has been gradually forming higher tops and higher bottoms. As per options data, once the stock closes above the Rs 1,720 level, which has the highest Call base, it is likely to move towards the Rs 1,800 level. Buy HCL Tech futures in the range of Rs 1,700–1,720. Strategy: Buy Target: Rs 1,760, Rs 1,800 Stop-Loss: Rs 1,645 Vidnyan S Sawant, Head of Research at GEPL Capital Shriram Finance | CMP: Rs 1,010.35 Shriram Finance continues to exhibit a robust structural uptrend across timeframes, characterised by a classical higher-top and higher-bottom price formation. On the weekly timeframe, the stock is firmly placed above its key 12- and 26-week EMAs, underscoring strong trend strength. The MACD momentum indicator is trending higher, reflecting acceleration in upside momentum and reinforcing the bullish bias. On the daily chart, the stock has displayed a bullish mean reversion from the 12-day DEMA, further validating the positive outlook and suggesting continuation of the prevailing uptrend. Strategy: Buy Target: Rs 1,081 Stop-Loss: Rs 970 Canara Bank | CMP: Rs 156.86 Canara Bank has recently displayed strong positive structural developments on the higher timeframe. During the October series, the stock witnessed a decisive breakout above its multi-year swing highs of 2010 and 2024, marking a transition into uncharted territory. The stock is firmly sustaining above its 12-, 26-, and 50-period DEMA, while continuing to form higher tops and higher bottoms, highlighting strong relative strength amid prevailing market volatility. Momentum indicators further validate this strength, with the MACD remaining in buy mode, reinforcing that the ongoing uptrend is well supported by positive momentum. Strategy: Buy Target: Rs 172 Stop-Loss: Rs 150 Bharat Electronics | CMP: Rs 412.8 BEL has been in a robust long-term uptrend since 2020, consistently demonstrating resilience on the monthly timeframe. On the weekly chart, the stock continues to form higher bottoms and is currently consolidating around its 26-week EMA, indicating healthy price digestion within an ongoing uptrend. On the daily timeframe, BEL maintains a higher-top and higher-bottom structure. Notably, during recent pullbacks, the stock has displayed a repetitive price behaviour wherein corrections tend to remain contained at around 4 percent, after which the stock resumes its upward trajectory. This recurring pattern reinforces the strength of the prevailing trend. Strategy: Buy Target: Rs 447 Stop-Loss: Rs 400 CCL Products India | CMP: Rs 983.75 CCL Products has been on a sustained upward trajectory since 2020, forming a sequence of higher tops and higher bottoms on the monthly timeframe, a classic indication of a long-term bullish trend. On the weekly chart, the stock has exhibited a bullish mean reversion from the 26-week EMA, while the Stochastic oscillator remains in buy mode, reinforcing the positive outlook. On the daily timeframe, the stock has witnessed a reversal from the 2025 gap support, further validating the underlying strength and confirming a constructive near-term sentiment. Strategy: Buy Target: Rs 1,101 Stop-Loss: Rs 944 Disclaimer: The views and investment tips expressed by experts on Moneycontrol are their own and not those of the website or its management. Moneycontrol advises users to check with certified experts before taking any investment decisions."
