Company,Title,Link,Article
Wipro,"Stocks to Watch Today: Reliance Ind, Paytm, Wipro, Indian Hume Pipe, JK Cement, Alembic Pharma, Axis Bank, IndusInd, Can Fin, Tanla Platforms in focus on 27 April",https://www.moneycontrol.com/news/business/markets/stocks-to-watch-today-reliance-ind-paytm-wipro-indian-hume-pipe-jk-cement-alembic-pharma-axis-bank-indusind-can-fin-tanla-platforms-in-focus-on-27-april-13899988.html,"Stocks to Watch Today, 27 April Stocks in Focus on April 27: Reliance Industries, Axis Bank, RBL Bank, IDFC First Bank, DCB Bank, Can Fin Homes, Lodha Developers, One 97 Communications Paytm, Indian Hume Pipe Company Did our AI summary help? RI UTI10 RI Watchlist Portfolio Message Follow NSE/BSE Select NSE LIVE BSE LIVE Trade Day High Day Low Volume (NSE) More UTI10 Watchlist Portfolio Message Follow NSE/BSE Select NSE LIVE BSE LIVE Trade Day High Day Low Volume (NSE) More × Add to Watchlist × Let's catch up on the latest news from the stock market. From significant investments to major deals, quarterly earnings, appointments, acquisitions, and order wins, here’s a quick look at which stocks will be in focus in today's trade: Results Today Coal India, UltraTech Cement, Adani Total Gas, AU Small Finance Bank, Aye Finance, Bajaj Housing Finance, Canara Robeco Asset Management Company, Jindal Saw, Nippon Life India Asset Management, Phoenix Mills, Piramal Finance, SBI Cards and Payment Services, Tamilnad Mercantile Bank, Unicommerce Esolutions, Varun Beverages, and Websol Energy System will announce their quarterly earnings today. Quarterly Earnings Tanla Platforms Q4 (Consolidated YoY) Related Stories IFCI shares hit 20% upper circuit as NSE likely to file DRHP next week Bank Nifty jumps 3%, all 14 stocks gain sharply; HDFC Bank, Axis Bank among top drivers of banking r... Nestle India declines 3% after FSSAI issues notice over alleged insect detection in Maggi; FMCG firm... Profit falls 8.9% to Rs 20,589 crore Vs Rs 22,611 crore Revenue grows 12.9% to Rs 3.25 lakh crore Vs Rs 2.88 lakh crore EBITDA declines 0.3% to Rs 48,588 crore Vs Rs 48,737 crore EBITDA margin slips 200 bps to 14.9% Vs 16.9% Board recommends a dividend of Rs 6 per share for FY26 Jio Platforms Q4 (Consolidated YoY) Profit soars 13% to Rs 7,935 crore Vs Rs 7,023 crore Revenue jumps 12.7% to Rs 44,928 crore Vs Rs 39,853 crore EBITDA surges 17.9% to Rs 20,060 crore Vs Rs 17,016 crore EBITDA margin expands 230 bps to 52.4% Vs 50.1% Average revenue per user (ARPU) rises 3.8% to Rs 214 Vs Rs 206.2 Total subscribers base increases 7.4% to 52.44 crore Vs 48.82 crore Axis Bank Q4 (Standalone YoY) Profit falls 0.6% to Rs 7,071.3 crore Vs Rs 7,117.5 crore Net interest income increases 4.7% to Rs 14,457.2 crore Vs Rs 13,810.5 crore Provisions and contingencies surge 159.1% to Rs 3,522.2 crore Vs Rs 1,359.4 crore Gross NPA slips to 1.23% Vs 1.40% (QoQ) Net NPA declines to 0.37% Vs 0.42% (QoQ) Board approves raising of funds up to Rs 20,000 crore via issuance of equity shares Board approves raising of funds up to Rs 35,000 crore via issuance of debt instrument IndusInd Bank Q4 (Standalone YoY) Profit stands at Rs 532.71 crore Vs loss of Rs 2,236 crore Net interest income zooms 43.4% to Rs 4,371.5 crore Vs Rs 3,048.3 crore Provisions and contingencies fall 38.6% to Rs 1,484.3 crore Vs Rs 2,416.6 crore Gross NPA declines to 3.43% Vs 3.56% (QoQ) Net NPA slips to 1% Vs 1.04% (QoQ) Sachin Patange steps down as Chief Compliance Officer of IndusInd Bank effective April 29 Board appoints Sunil Kumar Singh as the Chief Compliance Officer of the bank effective April 30 RBL Bank Q4 (Standalone YoY) Profit surges 234% to Rs 230 crore Vs Rs 69 crore Net interest income rises 7% to Rs 1,671 crore Vs Rs 1,563 crore Provisions and contingencies fall 13.6% to Rs 678.3 crore Vs Rs 785.1 crore Gross NPA At 1.45% Vs 1.88% (QoQ) Net NPA At 0.39% Vs 0.55% (QoQ) L&T Finance Q4 (Consolidated YoY) Profit soars 26.8% to Rs 806.6 crore Vs Rs 636.2 crore Net interest income jumps 24.8% to Rs 3,024 crore Vs Rs 2,423 crore M&M Financial Services Q4 (Standalone YoY) Profit soars 55% to Rs 873 crore Vs Rs 563.1 crore Revenue from operations grows 13.2% to Rs 4,800 crore Vs Rs 4,240.8 crore IDFC First Bank Q4 (Standalone YoY) Profit rises 4.9% to Rs 318.9 crore Vs Rs 304.1 crore Net interest income jumps 15.7% to Rs 5,677.2 crore Vs Rs 4,907.2 crore Provisions and contingencies fall 40% to Rs 869.2 crore Vs Rs 1,450.5 crore Gross NPA declines to 1.61% Vs 1.69% (QoQ) Net NPA slips to 0.48% Vs 0.53% (QoQ) Mangalore Refinery and Petrochemicals Q4 (Consolidated YoY) Profit sinks 68.4% to Rs 117 crore Vs Rs 370.6 crore Revenue rises 3.2% to Rs 28,493 crore Vs Rs 27,602 crore DCB Bank Q4 (YoY) Profit grows 16.1% to Rs 205.65 crore Vs Rs 177 crore Net interest income jumps 17.4% to Rs 655.2 crore Vs Rs 558 crore Provisions and contingencies increase 2.6% to Rs 69 crore Vs Rs 67.2 crore Gross NPA falls to 2.45% Vs 2.72% (QoQ) Net NPA declines to 0.89% Vs 1.10% (QoQ) Can Fin Homes Q4 (YoY) Profit spikes 47.8% to Rs 345.7 crore Vs Rs 233.9 crore Net interest income grows 20.7% to Rs 441.1 crore Vs Rs 365.3 crore Supreme Petrochem Q4 (Standalone YoY) Profit zooms 57.2% to Rs 168 crore Vs Rs 106.9 crore Revenue rises 3.1% to Rs 1,587 crore Vs Rs 1,539 crore Lodha Developers Q4 (Consolidated YoY) Profit grows 9.35% to Rs 1,007.9 crore Vs Rs 921.7 crore Revenue jumps 11.6% to Rs 4,713.5 crore Vs Rs 4,224.3 crore Tanla Platforms Q4 (Consolidated YoY) Profit rises 14.5% to Rs 134.3 crore Vs Rs 117.3 crore Revenue soars 15% to Rs 1,177.5 crore Vs Rs 1,024.4 crore India Cements Q4 (Consolidated YoY) Profit surges 142% to Rs 59.5 crore Vs Rs 24.6 crore Revenue grows 2.6% to Rs 1,228.65 crore Vs Rs 1,197.6 crore Exceptional loss stands at Rs 10.9 crore Vs exceptional gain of Rs 90.1 crore Stocks to Watch One 97 Communications Paytm The Reserve Bank of India has cancelled the banking licence of the company’s associate entity, Paytm Payments Bank, effective April 24. Consequently, Paytm Payments Bank is prohibited from conducting banking business. Following the RBI order, the Board of Directors and shareholders, on April 25, approved the necessary resolutions to enable the winding-up of Paytm Payments Bank. Wipro The company announced a strategic partnership with Kongsberg Digital, a global leader in advanced engineering and industrial digitalisation, to jointly deploy next-generation AI-powered digital twin solutions for the energy and utilities sector. Indian Hume Pipe Company The company has received a Letter of Intent worth Rs 417.97 crore from the Jihe Kathapur Lift Irrigation Division of the Maharashtra Krishna Valley Development Corporation (MKVDC). The order is for the construction of headworks and a closed pipe distribution system of the NER direct gravity main under the Guruvarya Late Laxmanraoji Inamdar Lift Irrigation Scheme, Maharashtra. JK Cement The company has been declared the preferred bidder for the mining lease of the Maliyakheri Limestone Block-I, which spreads over an area of 6.90 hectares in Chittorgarh, Rajasthan. Pine Labs The Board has approved the acquisition of a 100 percent stake in Shopflo Technologies by Pine Labs from the existing shareholders for Rs 88 crore. Manappuram Finance The Securities and Exchange Board of India (SEBI) has issued an administrative warning letter to V. P. Nandakumar, Chairman and Managing Director of the company, in his personal capacity. This relates to the delayed disclosure of encumbrance or pledge of his shares for transactions carried out between September 21 and 24, 2018. The disclosure was made on October 11, 2018, with a delay of seven days. Balrampur Chini Mills The company has approved the setting up of a lactogypsum processing plant at Kumbhi, Uttar Pradesh, to enhance value creation from by-products of PLA and strengthen its integrated operations. The proposed facility, with an estimated investment of up to Rs 160 crore, will manufacture gypsum boards using lactogypsum, a by-product of the company’s upcoming Polylactic Acid (PLA) project. Supreme Power Equipment The company has secured domestic orders worth Rs 128 crore from Hyderabad-based companies. With these order wins, the company’s order book stands at Rs 481.44 crore, while its subsidiary, Danya Electric Company, has an order book of Rs 96.28 crore, taking the combined total to Rs 577.72 crore. Tega Industries Sharad Kumar Khaitan has resigned as Chief Financial Officer (CFO) of the company to pursue other opportunities outside the Tega Group, effective May 5. Alembic Pharmaceuticals The company has received final approval from the US Food and Drug Administration (USFDA) for its Abbreviated New Drug Application (ANDA) for Fingolimod capsules, 0.5 mg. These are therapeutically equivalent to the reference listed drug (RLD), Gilenya capsules of Novartis Pharmaceuticals Corporation. Fingolimod is a sphingosine 1-phosphate receptor modulator indicated for the treatment of relapsing forms of multiple sclerosis (MS). Pace Digitek The company, along with its subsidiary Lineage Power, has announced an original equipment manufacturer (OEM) partnership with NEC XON Systems Proprietary, South Africa. Under this partnership, NEC XON will market, distribute, and deploy the company’s product portfolio, including grid-scale Battery Energy Storage Systems (BESS) and related energy solutions, across South Africa, Botswana, Mozambique, Namibia, and Mauritius. UPL The company’s step-down subsidiary, United Phosphorus Holdings Brazil BV, will enter into an agreement for a further investment of $86.7 million (BRL 450 million) in Sinova Inovações Agrícolas SA, an associate entity of the company. The investment is intended for working capital requirements and debt reduction. Following this investment, UPL Brasil’s stake in Sinova will increase from 49.97 percent to 55.81 percent. Bulk and Block Deals ADF Foods SBI Funds Management has bought 13 lakh shares in ADF Foods at Rs 259.98 per share and 9 lakh shares at Rs 260 per share, amounting to a 2 percent stake worth Rs 57.19 crore. Pfizer ICICI Prudential Mutual Fund, through its Discovery Fund, has acquired 4 lakh shares in Pfizer (0.87 percent stake) for Rs 188 crore at Rs 4,700 per share. Meanwhile, Goldman Sachs Funds, through the Goldman Sachs India Equity Portfolio, sold 4.26 lakh shares (0.93 percent stake) for Rs 200.25 crore at Rs 4,700.01 per share. ICICI Prudential Mutual Fund already held a 2.16 percent stake in Pfizer as per the shareholding pattern of March 2026. Orient Electric Nippon India Mutual Fund has purchased an additional 12.85 lakh shares (0.6 percent stake) in Orient Electric for Rs 23.9 crore at Rs 185.96 per share. Nippon Life India Trustee, via Nippon India SMA, already held a 5.49 percent stake in Orient Electric as of March 2026. VA Tech Wabag BlackRock-managed iShares Global Water UCITS ETF has acquired an additional 4.92 lakh shares (0.79 percent stake) in VA Tech Wabag for Rs 73.47 crore at Rs 1,491.53 per share. The ETF held a 1.21 percent stake in the company as of March 2026. South West Pinnacle Exploration Rational Equity Flagship Fund I, a Category III alternative investment fund managed by Rational Asset Management, has sold 1.54 lakh shares (0.51 percent stake) in South West Pinnacle Exploration for Rs 3.42 crore at Rs 222.45 per share. Stocks Trade Ex-Dividend 360 ONE WAM Alka India Stock Trades Ex-Date for Reduction of Capital Trustwave Securities Stock in F&O Ban SAIL Disclaimer: Moneycontrol is a part of the Network18 group. Network18 is controlled by Independent Media Trust, of which Reliance Industries is the sole beneficiary."
Wipro,"AI rewrites playbook for TCS, Infosys, Wipro as growth outlook splits: Report",https://www.moneycontrol.com/news/business/companies/ai-rewrites-playbook-for-tcs-infosys-wipro-as-growth-outlook-splits-report-13899864.html,"This paradigm shift is starkly reflected in mixed FY27 outlooks and evolving talent metrics. (Representative Photo) Indian IT firms hit by AI disruption, global economic strain TCS, Infosys profits rise; HCLTech, Wipro face uncertainty AI-led deals offset revenue decline in traditional IT services Did our AI summary help? India’s top IT firms — TCS, Infosys, HCLTech, Wipro, and Tech Mahindra — closed FY26 at a turning point, navigating global economic pressures, West Asian geopolitical tensions, and the rapid rise of Artificial Intelligence (AI), according to a PTI report. The sector is steadily moving away from traditional effort-based services, as AI-driven productivity begins to compress revenues in legacy businesses. However, this pressure is being partly offset by a surge in large AI-led deals, pushing companies to shift from scale-based contracts to more outcome-driven, modular engagements. This transition is reflected in mixed outlooks for FY27. While TCS and Infosys indicated easing macro headwinds, HCLTech and Wipro flagged continued uncertainty and weak discretionary spending. A report by ICICI Direct noted, ""AI may cause about 2-3 per cent annual deflation in traditional IT services revenues for the next couple of years. Indian IT services could see an incremental AI-led TAM of USD 300-400 billion by 2030."" TCS reported a 12.22 per cent rise in March quarter net profit to Rs 13,718 crore, with revenue growing 9.64 per cent to Rs 70,698 crore. For FY26, profit rose 1.35 per cent to Rs 49,210 crore, while revenue increased 4.58 per cent to Rs 2.67 lakh crore. The company said it is entering the new fiscal year with positive momentum, adding that most recent headwinds are behind it. Its annualised AI services revenue crossed USD 2.3 billion, accounting for over 6 per cent of total revenue. Related Stories Stocks to Watch Today: Dabur India, Sagility, GNG Electronics, Lenskart Solutions, Hexagon Nutrition... Infosys stock rating: CLSA bullish, sees $300-400 billion opportunity in GenAI; check target price Infosys shares fall over 1.5% as stock turns ex-dividend; price adjusts downward TCS CEO K Krithivasan said the company is entering the new fiscal year with positive momentum driven by deal wins and expects limited impact from the West Asia crisis, largely confined to clients in travel, transportation, and the Gulf region. Infosys posted a 20.8 per cent jump in consolidated net profit to Rs 8,501 crore in the March quarter, with revenue rising 13.4 per cent to Rs 46,402 crore. For FY26, profit grew 10.20 per cent to Rs 29,440 crore and revenue rose 9.6 per cent to Rs 178,650 crore. The company acknowledged that AI is beginning to cannibalise traditional services, though growth in AI-led offerings is offsetting the impact. ""With the Iran war, there was a change in the economic environment, but there seem to be paths towards things stabilising. What we understand (through) talking to people in the market and the clients is that the underlying resilience of some of the economies where we have big markets is pretty good. The economies are doing well. There are good investments. AI is growing well,"" Infosys CEO Salil Parekh said. HCLTech reported a 4.2 per cent rise in Q4 net profit to Rs 4,488 crore, with revenue up 12.34 per cent to Rs 33,981 crore. For FY26, profit declined 4.30 per cent to Rs 16,642 crore, while revenue increased 11.18 per cent to Rs 130,144 crore. The company projected FY27 growth of 1-4 per cent in constant currency, citing continued volatility. ""During the quarter, our performance came below our expectations due to softness in certain parts of our business, due to lower discretionary spend and delayed decision-making. ""Our new AI-led service offerings are getting traction in the market and are reflected in annualised Advanced AI revenues crossing USD 620 million in Q4. Our #1 priority in FY27 is to ensure the company is positioned right to take advantage of AI opportunities for multi-decade value creation,"" said HCLTech CEO C Vijayakumar. Wipro reported a 1.89 per cent decline in Q4 net profit to Rs 3,501.8 crore, while revenue rose 7.6 per cent to Rs 24,236.3 crore. For FY26, net profit rose marginally by 0.47 per cent to Rs 13,197.4 crore, with revenue at Rs 92,624 crore. The company described the current macro environment as the “new normal”, shaped by geopolitical and policy disruptions, and approved a Rs 15,000 crore share buyback. Tech Mahindra posted a 16 per cent increase in Q4 net profit to Rs 1,353.8 crore, with revenue up 12.6 per cent to Rs 15,076.1 crore. For FY26, profit rose 13.15 per cent to Rs 4,810.9 crore, while revenue grew 7.2 per cent to Rs 56,815.4 crore. The company said AI presents a significant medium- to long-term opportunity for client transformation rather than a risk to revenues. *With Agency Inputs"
Wipro,"TCS, Infosys, HCLTech, Wipro, Tech M report muted FY26 hiring; workforce shrinks by 7,389",https://www.moneycontrol.com/news/business/information-technology/tcs-infosys-hcltech-wipro-tech-m-report-muted-fy26-hiring-workforce-shrinks-by-7-389-13899069.html,"Representative image Financial year 2026 showed a clear shift in India’s IT hiring narrative, with the country’s top firms turning cautious on workforce expansion as they restructure business operations around their artificial intelligence (AI) goals. Overall headcount addition across Tata Consultancy Services (TCS), Infosys, HCLTech, Wipro and Tech Mahindra plunged sharply, falling by 7,389 in FY26, reversing the modest gains of 12,718 seen in FY25. The biggest shocker for the IT industry in FY26 was the country's largest private sector employer TCS deciding to lay off 12,000 people from its workforce. This was the biggest job cut by an Indian corporate entity in recent times. This had led to the overall hiring of the top five IT companies to slide to negative, though three out of five firms have reported net positive headcount addition. Management commentary across the board have continued to signal caution when it came to hiring. Companies shied away from sharing definitive outlook on hiring plans for FY27. Individually, in Q4FY26, Infosys’ headcount decreased by 8,440 employees while TCS added 2,356, HCLTech added 802 employees and Wipro’s headcount marginally increased by 135 sequentially. Tech Mahindra lost around 1,993 employees. Related Stories Stocks to Watch Today: Dabur India, Sagility, GNG Electronics, Lenskart Solutions, Hexagon Nutrition... Infosys stock rating: CLSA bullish, sees $300-400 billion opportunity in GenAI; check target price Infosys shares fall over 1.5% as stock turns ex-dividend; price adjusts downward According to Nasscom’s latest annual strategic review, India’s technology industry added only about 2,000 more net jobs year-on-year in FY26. Net additions stood at roughly 1.35 lakh employees, only marginally higher than the approximately 1.33 lakh jobs added in FY25, indicating that hiring growth has largely plateaued. At an industry level, the sector’s total workforce grew to 59.5 lakh (5.95 million) employees in FY26, up from 58.2 lakh (5.82 million) in the previous year, translating into a 2.3 percent increase in headcount. Fresher hiring targets TCS said it will hire 25,000 freshers in FY27 as of now, and will increase target depending on the demand during the year. This is significantly lower than its previous fresher addition of 40,000-42,000 in FY25 and FY26. Infosys plans to hire for a similar fresher number of 20,000 in the new fiscal year, as it did in FY26. HCLTech, Tech Mahindra and Wipro said they will decide as the new fiscal year progresses. In FY26, HCLTech added 11,744 freshers and Wipro added 7,500 employees. What did the company managements say? TCS said it is focused on building a “future ready organization by strategically hiring both fresh graduates and experienced professionals. “Our recruitment efforts have been concentrated on individual with expertise in AI, data, enterprise solutions, software engineering, cloud, cybersecurity and digital engineering. In FY2026 we also hired over 750 employees with deep advisory and consulting expertise. We stepped up our investments in talent development initiatives as well,” said Sudeep Kunnumal, CHRO, TCS during the company’s earnings conference on April 9. Infosys CFO Jayesh Sanghrajka said the headcount decline was due to quarterly seasonality. “Our headcount sequentially has gone down, but on a YoY basis it has gone up by 5,000 people. There’s always some quarterly seasonality. Headcount is a function of utilisation and the volumes we see. This quarter the volumes were softer, plus the freshers in the system had to be accounted for,” he said. Rationalising headcount and improving utilisation rate of the existing employees is the backbone of Tech Mahindra’s strategy to improve margins under its three-year business transformation plan. “We had a hired significant number of freshers in the first year of the our plan. As we get into the second year, there was a change in strategy. We said we will take a pause. There was a change demand profile with AI also. This year was more adjustment of that with minimum fresher hiring. As we get into the next year, I think we will resume some of that going forward,” said Rohit Anand, CFO, Tech Mahindra. He added, “But we have not really clearly outlined the number. It won't be as much as the first year. It will definitely be better than what we did last year, which will be in the middle somewhere.” In FY27, HCLTech will be hiring similar number of freshers as it did this year, but the company didn’t state an exact number of headcount to add as it gets evaluated on a quarterly basis. Ram Sundararajan, Chief People Ofiicer, HCLTech said, “Overall hiring is always going to be a variable number. It's very difficult to give an annual forecast for that. Generally, it works on the basis of quarterly and monthly run rates. Entry level hiring, it's going to be on similar lines as what we have done for this year. In the current environment, trying to put out a number on a full year basis, is not going to be a the wise thing to do.” “We don't have any target for fresher hiring for next fiscal. It's completely on demand, very volatile environment,” Wipro’s Chief Human Resource Officer Saurabh Govil said."
Wipro,Watch,,ERROR: Invalid URL 'nan': No scheme supplied. Perhaps you meant https://nan?
Wipro,Advisory Alert:,,ERROR: Invalid URL 'nan': No scheme supplied. Perhaps you meant https://nan?
Wipro,Trending Topics,,ERROR: Invalid URL 'nan': No scheme supplied. Perhaps you meant https://nan?
Wipro,News,,ERROR: Invalid URL 'nan': No scheme supplied. Perhaps you meant https://nan?
Wipro,Markets,,ERROR: Invalid URL 'nan': No scheme supplied. Perhaps you meant https://nan?
Wipro,Personal Finance,,ERROR: Invalid URL 'nan': No scheme supplied. Perhaps you meant https://nan?
Wipro,Mutual Funds,,ERROR: Invalid URL 'nan': No scheme supplied. Perhaps you meant https://nan?
Wipro,Tools,,ERROR: Invalid URL 'nan': No scheme supplied. Perhaps you meant https://nan?
Wipro,Community,,ERROR: Invalid URL 'nan': No scheme supplied. Perhaps you meant https://nan?
Wipro,Network 18 Sites,,ERROR: Invalid URL 'nan': No scheme supplied. Perhaps you meant https://nan?
Wipro,Quick Links,,ERROR: Invalid URL 'nan': No scheme supplied. Perhaps you meant https://nan?
Wipro,You got30 Day’s Trialof,,ERROR: Invalid URL 'nan': No scheme supplied. Perhaps you meant https://nan?
